{
  "title": "Faraday Exercises",
  "type": "exercise-set",
  "era": "nineteenth-century",
  "texts": ["faraday-experimental-researches-in-electricity"],
  "description": "Field line reasoning, electromagnetic induction problems, and Faraday's conceptual approach to electromagnetism",
  "filename": "content.md",
  "prerequisites": []
}
