{
  "title": "Inclined Plane Lab",
  "type": "lab-manual",
  "era": "renaissance-scientific-revolution",
  "texts": ["galileo-two-new-sciences"],
  "description": "Measuring acceleration and testing the times-squared law with an inclined plane — reproducing Galileo's foundational kinematics experiments",
  "filename": "content.md",
  "prerequisites": []
}
