{
  "title": "A Year with the Sun",
  "type": "lab-manual",
  "era": "ancient-greece",
  "texts": ["ptolemy-almagest"],
  "description": "A long-duration observational practice — recording the sun's position at sunrise, noon, or sunset over the course of months, charting the patterns Ptolemy's tables describe, and seeing the solar year emerge from one's own observations",
  "filename": "content.md",
  "prerequisites": []
}
